{
  "$schema" : "http://json-schema.org/draft-07/schema#",
  "type" : "object",
  "properties" : {
    "@context" : {
      "type" : "array",
      "items" : {
        "type" : "string"
      }
    },
    "credentialSchema" : {
      "type" : "object",
      "properties" : {
        "id" : {
          "type" : "string"
        },
        "type" : {
          "type" : "string"
        }
      },
      "additionalProperties" : false
    },
    "credentialStatus" : {
      "type" : "object",
      "properties" : {
        "id" : {
          "type" : "string"
        },
        "type" : {
          "type" : "string"
        }
      },
      "additionalProperties" : false
    },
    "credentialSubject" : {
      "type" : "object",
      "properties" : {
        "birthDate" : {
          "type" : "string"
        },
        "birthPlace" : {
          "type" : "string"
        },
        "company" : {
          "type" : "object",
          "properties" : {
            "address" : {
              "type" : "string"
            },
            "email" : {
              "type" : "string"
            },
            "foundingDate" : {
              "type" : "string"
            },
            "hasInternationalActivity" : {
              "type" : "boolean"
            },
            "isRecipientOfPublicFunds" : {
              "type" : "boolean"
            },
            "isRiskSector" : {
              "type" : "boolean"
            },
            "name" : {
              "type" : "string"
            },
            "revenue" : {
              "type" : "string"
            },
            "ultimateBeneficialOwners" : {
              "type" : "array",
              "items" : {
                "type" : "object",
                "properties" : {
                  "address" : {
                    "type" : "string"
                  },
                  "birthDate" : {
                    "type" : "string"
                  },
                  "birthPlace" : {
                    "type" : "string"
                  },
                  "citizenship" : {
                    "type" : "string"
                  },
                  "familyName" : {
                    "type" : "string"
                  },
                  "givenName" : {
                    "type" : "string"
                  },
                  "isPep" : {
                    "type" : "boolean"
                  },
                  "taxID" : {
                    "type" : "string"
                  }
                },
                "additionalProperties" : false
              }
            },
            "vatId" : {
              "type" : "string"
            }
          },
          "additionalProperties" : false
        },
        "execRappr" : {
          "type" : "string"
        },
        "familyName" : {
          "type" : "string"
        },
        "givenName" : {
          "type" : "string"
        },
        "id" : {
          "type" : "string"
        },
        "taxID" : {
          "type" : "string"
        }
      },
      "additionalProperties" : false
    },
    "expirationDate" : {
      "type" : "string"
    },
    "id" : {
      "type" : "string"
    },
    "issuanceDate" : {
      "type" : "string"
    },
    "issued" : {
      "type" : "string"
    },
    "issuer" : {
      "type" : "string"
    },
    "proof" : {
      "type" : "object",
      "properties" : {
        "created" : {
          "type" : "string"
        },
        "creator" : {
          "type" : "string"
        },
        "domain" : {
          "type" : "string"
        },
        "jws" : {
          "type" : "string"
        },
        "nonce" : {
          "type" : "string"
        },
        "proofPurpose" : {
          "type" : "string"
        },
        "type" : {
          "type" : "string"
        },
        "verificationMethod" : {
          "type" : "string"
        }
      },
      "additionalProperties" : false
    },
    "type" : {
      "type" : "array",
      "items" : {
        "type" : "string"
      }
    },
    "validFrom" : {
      "type" : "string"
    }
  },
  "required" : [ "@context", "type" ],
  "additionalProperties" : false
}